{
  "uuid": "a1b2c3d4-e5f6-7890-abcd-ef1234567890",
  "timestamp": "2025-03-15T14:30:00Z",
  "actor_uuid": "a1b2c3d4-e5f6-7890-abcd-ef1234567890",
  "actor_details": "example-value",
  "action": "example-value",
  "object_type": "LOGIN",
  "object_uuid": "a1b2c3d4-e5f6-7890-abcd-ef1234567890",
  "object_details": {},
  "aux_id": 26,
  "aux_uuid": "a1b2c3d4-e5f6-7890-abcd-ef1234567890",
  "aux_details": {},
  "aux_info": "example-value",
  "session": {
    "uuid": "a1b2c3d4-e5f6-7890-abcd-ef1234567890",
    "login_time": "2025-03-15T14:30:00Z",
    "device_uuid": "a1b2c3d4-e5f6-7890-abcd-ef1234567890",
    "ip": "example-value"
  },
  "location": "example-value"
}